question,option1,option2,option3,option4,option5,answer
Which of the following NMAP options can be used for TCP sweep scan?,–PE,–PP,–PM,None of these.,,None of these.
To see why NMAP is reporting any port as open or close (or a host as up or down) which of the following options is used?,#NAME?,#NAME?,#NAME?,None of these.,,None of these.
Which of the following sweep scans are automatically done when we use –sn option.,ICMP Echo,ICMP Non-Echo,TCP Sweep,UDP Sweep,,ICMP Echo; ICMP Non-Echo; TCP Sweep
"The number of host (IP) scanned by NMAP command “nmap –sL 192.168.62.40-50” will be _________.
Correct Answer: 11

Q8. In NMAP by default, _________ number of ports are scanned.
Correct Answer: 1000

Q9. Which of the following NMAP options treats all hosts as online (skip host discovery)?",–sP,–PO,–sU,–Pn,,–Pn
Which of the following NMAP options is used for Service and Version detection?,–sL,–sP,–PO,–sU,None of these.,None of these.
